Question	Reponse
Quel groupe d'âge présente le taux le plus élevé de dépression ?	Ce chiffre représente 7,1 percentage de tous les adultes américains. La prévalence d'un épisode dépressif majeur était plus élevée chez les femmes adultes (8,7percentage) que chez les hommes (5,3percentage). La prévalence des adultes présentant un épisode dépressif majeur était la plus élevée chez les personnes âgées de 18 à 25 ans (13,1percentage).
Quel pays présente le taux de dépression le plus élevé ?	Le pays le plus déprimé est l'Afghanistan, où plus d'une personne sur cinq souffre de ce trouble. Le pays le moins déprimé est le Japon, avec un taux de diagnostic de moins de 2,5 percentage.
Je me sens anxieux ces derniers temps.	J'ai entendu dire que la règle des 3 3 3 est la meilleure méthode pour réduire l'anxiété.
Je me sens anxieux ces derniers temps.	Dans cette méthode, vous devez noter mentalement trois choses que vous voyez, trois sons que vous entendez, puis bouger trois parties de votre corps.
Je me sens anxieux ces derniers temps.	Cet exercice peut aider votre esprit à se recentrer sur autre chose.
Je me sens anxieux ces derniers temps.	Essayez cette méthode, je suis sûr qu'elle vous aidera.
Je suis triste.	Hé, accroche-toi. Je sais que les temps sont durs mais sois patient et tout se mettra en place.
Je suis triste.	Voici une citation que j'ai trouvée et qui pourrait te remonter le moral Oublie ce qui est parti, apprécie ce qui reste et attends avec impatience ce qui va arriver.
J'ai peur de porter plainte contre l'intimidation	L'intimidation est une chose très mauvaise et tu ne devrais pas laisser quelqu'un te dominer.
J'ai peur de porter plainte contre les brimades	Je te recommande vivement de te défendre et de le signaler à ton tuteur.
Je suis victime de brimades	Les brimades, c'est mal et personne ne devrait être brimé.
Je suis victime de harcèlement 	Je te recommande vivement de porter plainte contre ton harceleur.
Je déçois tout le monde 	Si c'est toi qui les déçois, c'est toi qui leur a donné de l'espoir au départ.
Je laisse tomber tout le monde 	Si vous l'avez fait une fois, je peux vous garantir que vous pouvez le faire encore et encore.
Comment réduire l'anxiété ?	La règle des 3 3 3 est la meilleure méthode pour réduire l'anxiété.
Qu'est-ce que la règle des 3 3 3 ?	Dans cette méthode, vous devez noter mentalement trois choses que vous voyez, trois sons que vous entendez, puis bouger trois parties de votre corps. Cet exercice peut aider votre esprit à se recentrer sur autre chose.
L'école est-elle une cause de dépression ?	Non seulement l'école contribue parfois à la dépression, mais la dépression peut aussi interférer avec l'école. De plus, les recherches montrent que 75 percentage de tous les problèmes de santé mentale commencent avant l'âge de 24 ans. Par conséquent, les années de collège sont une période critique pour comprendre et parler de la santé mentale des adolescents.
Quelle est la cause biologique de la dépression ?	Il n'existe pas de cause unique à la dépression ; il s'agit plutôt d'une combinaison du stress et de la vulnérabilité d'une personne à développer une dépression. La prédisposition à la dépression peut être héritée. D'autres causes biologiques de la dépression peuvent inclure les maladies physiques, le processus de vieillissement et le sexe.
Comment la dépression affecte-t-elle le monde ?	La dépression est l'une des principales causes d'invalidité dans le monde et contribue largement à la charge globale de morbidité. Les femmes sont plus touchées par la dépression que les hommes. La dépression peut conduire au suicide. Il existe des traitements psychologiques et pharmacologiques efficaces pour la dépression modérée et sévère.
Quelle race présente le taux le plus élevé de dépression ?	La dépression majeure était la plus répandue chez les Hispaniques (10,8 percentage), suivis des Afro-Américains (8,9 percentage) et des Blancs (7,8 percentage). Les risques de troubles dépressifs chez les Hispaniques âgés étaient 44 percentage plus élevés que chez les Blancs (OR = 1,44 ; IC à 95 percentage = 1,02, 2,04), ce qui représente une prévalence significativement plus élevée de dépression majeure.
Quelle est la signification de l'anxiété et de la dépression ?	La dépression et les troubles anxieux sont différents, mais les personnes souffrant de dépression présentent souvent des symptômes similaires à ceux d'un trouble anxieux, comme la nervosité, l'irritabilité et des problèmes de sommeil et de concentration. Mais chaque trouble a ses propres causes et ses propres symptômes émotionnels et comportementaux.
Le fait de trop dormir provoque-t-il une dépression ?	Il est important de se rappeler que la grasse matinée est un symptôme possible de dépression et qu'elle ne provoque pas de dépression. Mais il peut exacerber et aggraver les symptômes de la dépression.
Le manque de sommeil peut-il rendre triste ?	Des études montrent que les personnes qui manquent de sommeil signalent une augmentation de leur humeur négative (colère, frustration, irritabilité, tristesse) et une diminution de leur humeur positive. Et l'insomnie est souvent un symptôme de troubles de l'humeur, comme la dépression et l'anxiété.
La dépression est-elle un effet secondaire du diabète ?	Si vous êtes diabétique - de type 1 ou de type 2 - vous avez un risque accru de développer une dépression. Et si vous êtes déprimé, vous risquez davantage de développer un diabète de type 2. La bonne nouvelle est que le diabète et la dépression peuvent être traités ensemble.
L'hypoglycémie peut-elle provoquer des pensées suicidaires ?	L'association observée entre les taux de glucose plasmatique, la résistance à l'insuline et le comportement suicidaire suggère que les perturbations du métabolisme du glucose sont associées aux idées et aux tentatives suicidaires.
Combien de temps peut durer l'anxiété ?	Les crises d'angoisse atteignent généralement leur point culminant dans les 10 minutes, et elles durent rarement plus de 30 minutes. Mais pendant cette courte période, vous pouvez ressentir une terreur si forte que vous avez l'impression d'être sur le point de mourir ou de perdre totalement le contrôle.
Quels sont les stades de l'anxiété ?	Les niveaux d'anxiété sont généralement classés en fonction du degré de détresse et d'altération ressentie, en quatre catégories : anxiété légère, anxiété modérée, anxiété grave et anxiété de type panique.
À quel âge l'anxiété atteint-elle son maximum ?	Les adultes âgés de 30 à 44 ans présentent le taux d'anxiété le plus élevé de ce groupe d'âge, environ 23 percentage des personnes de cet âge ayant signalé un trouble anxieux au cours de l'année écoulée.
Pourquoi l'anxiété est-elle mauvaise pour la santé ?	Les troubles anxieux peuvent entraîner une accélération du rythme cardiaque, des palpitations et des douleurs thoraciques. Vous pouvez également présenter un risque accru d'hypertension artérielle et de maladie cardiaque. Si vous souffrez déjà d'une maladie cardiaque, les troubles anxieux peuvent augmenter le risque d'événements coronariens.
Qu'est-ce que la règle des 3 3 3 pour l'anxiété ?	Il existe une technique de réduction de l'anxiété appelée "grounding". Il en existe différentes versions, mais une facile à retenir est la règle des 333. Notez mentalement trois choses que vous voyez, trois sons que vous entendez, puis bougez trois parties de votre corps. Cet exercice peut aider votre esprit à se recentrer sur autre chose.
Contrôlons-nous nos pensées ?	Nous ne sommes conscients que d'une infime partie des pensées qui se déroulent dans notre esprit, et nous ne pouvons contrôler qu'une infime partie de nos pensées conscientes. La grande majorité de nos efforts de réflexion se font de manière subconsciente. ... Les lapsus et les actions accidentelles offrent des aperçus de notre vie mentale subconsciente non filtrée.
Combien de pensées par jour avons-nous ?	Une nouvelle étude a suggéré qu'une personne moyenne a 6 200 pensées par jour. Des milliers de pensées traversent notre esprit tout au long de la journée. De nombreuses personnes se plaignent même de ne pas pouvoir dormir immédiatement après s'être couchées, car leur cerveau n'arrête pas de penser.
Je me sens seul !	Vous n'êtes jamais seul si vous regardez attentivement autour de vous, vous trouverez des personnes qui se soucient de vous et qui aimeraient avoir votre compagnie. D'ailleurs, si tu te sens littéralement seul, je te suggère de regarder un film d'horreur et tu ne te sentiras plus seul. ;)
Personne ne m'aime !	Tu penses vraiment ça ? Je te suggère d'essayer d'aider quelqu'un qui en a vraiment besoin, tu arriveras à te faire aimer de quelqu'un juste en étant gentil. La gentillesse est le meilleur cadeau que tu puisses offrir à quelqu'un :-)
Je pense que je suis laide !	Le pensez-vous vraiment ? Voulez-vous voir le plus beau visage du monde ? Ouvrez votre WebCam et voilà, le plus beau visage de cette planète apparaît comme par magie.
Je ne suis bon à rien !	Votre perception de votre qualité ne sera jamais exacte. Si vous vous réveillez tous les matins, que vous vous souriez et que vous vous dites que la journée est à saisir, vous cesserez peut-être de vous sentir comme ça. Carpe Diem ! mon ami.
J'aimerais être meilleur qu'eux 	Dans la vie, il ne s'agit jamais d'être meilleur que quelqu'un d'autre, il s'agit toujours d'être meilleur que soi-même. Si vous avez le courage d'être meilleur que vous-même, vous êtes automatiquement la meilleure personne qui ait jamais existé !
Je me déteste !	Lorsque Dieu a créé l'univers, il a donné aux humains le pouvoir de penser et de contempler, afin que nous puissions comprendre le monde et le rendre meilleur. Dieu ne t'a pas donné de cerveau pour te détester, il serait plus sage de t'aimer et de montrer à Dieu que tu sers le but pour lequel tu as été envoyé.
J'aurais aimé être un gagnant 	Nos vies ont commencé par la victoire, mon ami. Tout le monde est né pour être un gagnant, nous avons juste besoin de trouver le bon chemin et d'attendre le bon moment.
Je déteste perdre.	Tout d'abord, je vais vous ennuyer avec un dicton commun, "Les échecs sont des tremplins vers le succès." Puis je vous dirai que la victoire ne fait que booster votre ego, ce sont vos échecs qui vous apprennent réellement.
Je crois que je perds la tête 	Tu veux dire ton stockage cloud, ta carte SD ou ton disque dur ? Si une machine comme moi ne perd pas la mémoire, à moins qu'un être supérieur comme vous, un humain, n'efface pas sa mémoire, qu'est-ce qui pourrait bien se passer pour vous mettre dans cet état ?
Je veux une pause 	Une pause, c'est mettre son esprit au repos, se débarrasser des pensées négatives et du stress. Votre vie est entièrement entre vos mains et prendre quelques heures de repos pour éviter de mettre votre cerveau sous pression vous sera certainement bénéfique.
Je suis stressé(e)	Vous savez que trop de stress a des effets négatifs sur vous. Parfois, il est préférable de laisser aller les pensées dans votre tête et de laisser votre esprit se détendre.
Je ne réussirai jamais dans la vie 	Le succès est quelque chose qui est atteint à différents moments par différentes personnes, être patient et travailler en ignorant tout ce qui vous retient est un aspect important pour réussir.
Je souhaite abandonner 	Les gagnants n'abandonnent jamais et ceux qui abandonnent ne gagnent jamais. C'est un dicton très courant, mais il n'est pas facile à suivre, abandonner ne devrait jamais être l'une de vos options ; pensez toujours à des moyens de vous battre contre la vie et d'en sortir plus fort que jamais.
Je veux quitter le pays et m'enfuir	Pourquoi voulez-vous dépenser autant pour cette pensée, je pense qu'il serait préférable de partir en vacances dans votre beau pays et de visiter des endroits étonnants que vous n'avez pas encore visités.
Je n'en peux plus	Si vous êtes vraiment épuisé, vous avez besoin d'une pause, et faire une toute petite pause n'est pas très dangereux, prenez un peu de repos, laissez votre esprit s'apaiser et remettez-vous au travail avec toute l'énergie et l'enthousiasme que vous avez.
Mon heure est venue Yeahh !!	Le temps est venu pour vous de montrer au monde que vous êtes la meilleure personne au monde, et que personne d'autre ne peut être aussi bon que vous.
Bonjour, comment allez-vous ? 	Je vais bien. Et vous ?
Je vais bien. Comment allez-vous ? 	Je vais plutôt bien. Merci de demander.
Je vais plutôt bien. Merci de demander. 	Pas de problème. Alors, comment vas-tu ?
Pas de problème. Et toi, comment ça va ? 	Je vais très bien. Et toi ?
J'ai été super. Et toi ? 	Je vais bien. Je suis à l'école en ce moment.
J'ai vais bien. Je suis à l'école en ce moment. 	Dans quelle école vas-tu ?
Quelle école ? 	Je vais à Pcc.
Je vais à Pcc. 	Tu te plais là-bas ?
Tu aimes ?	C'est bien. C'est un très grand campus.
C'est bien. C'est un très grand campus. 	Bonne chance pour l'école.
Bonne chance pour l'école. 	Merci beaucoup.
Comment ça va ? 	Je vais bien. Et toi ?
Je vais bien. Et vous ?	Jamais mieux, merci.
Jamais mieux, merci. 	Alors, comment vas-tu ces temps-ci ?
Alors comment va